{
    "visualization_prompt": "Create a Highcharts pie chart with the following specifications: Chart type: pie, Chart title: 'The percentage of information transmitted to the brain', Axes and labels styling: Use a green color (#33cc33) for the 'Visual information' slice and a purple color (#cc33cc) for the 'None visual information' slice. The title font size should be 18px, and the data labels should be bold with a font size of 14px. Data series: The first series should be named 'Brands' and contain two data points: 'Visual information' with a value of 90 and 'None visual information' with a value of 10. Custom colors: Use the specified colors for the data points. Additional configurations: Enable point selection, set the cursor to pointer, and format the data labels to show the name and percentage of each slice.",
    "visualization_code": {
        "chart": {
            "plotBackgroundColor": null,
            "plotBorderWidth": null,
            "plotShadow": false,
            "type": "pie"
        },
        "title": {
            "text": "The percentage of information transmitted to the brain",
            "style": {
                "fontSize": "18px"
            }
        },
        "tooltip": {
            "pointFormat": "{series.name}: <b>{point.percentage:.1f}%</b>"
        },
        "plotOptions": {
            "pie": {
                "allowPointSelect": true,
                "cursor": "pointer",
                "dataLabels": {
                    "enabled": true,
                    "format": "<b>{point.name}</b>: {point.percentage:.1f} %",
                    "style": {
                        "fontSize": "14px",
                        "fontWeight": "bold"
                    }
                }
            }
        },
        "series": [
            {
                "name": "Brands",
                "colorByPoint": true,
                "data": [
                    {
                        "name": "Visual information",
                        "y": 90,
                        "sliced": true,
                        "selected": true,
                        "color": "#33cc33"
                    },
                    {
                        "name": "None visual information",
                        "y": 10,
                        "color": "#cc33cc"
                    }
                ]
            }
        ]
    },
    "visualization_explanation": "The provided Highcharts configuration object is designed to render a pie chart that visualizes the percentage of information transmitted to the brain. The chart is titled 'The percentage of information transmitted to the brain' with a font size of 18px. The pie chart consists of two slices: 'Visual information' with a value of 90 and 'None visual information' with a value of 10. The 'Visual information' slice is highlighted by being sliced out and selected by default, and both slices have custom colors: green (#33cc33) for 'Visual information' and purple (#cc33cc) for 'None visual information'. The data labels are enabled and formatted to display the name and percentage of each slice in bold with a font size of 14px. Additionally, the chart allows for point selection and sets the cursor to a pointer when hovering over the pie slices."
}