{
    "visualization_prompt": "Create a Highcharts chartOptions object to render a spline chart with the following specifications: The chart should have a title 'Meals Data Analysis'. The x-axis should represent the 'Day of Week' and the y-axis should represent the 'Number of Meals'. The chart should display three data series: 'Sold meals', 'Disposed meals', and 'Total meals'. Each series should have custom colors: 'Sold meals' in green, 'Disposed meals' in red, and 'Total meals' in blue. The chart should have a white background, and the legend should be positioned at the bottom of the chart.",
    "visualization_code": {
        "chart": {
            "type": "spline",
            "backgroundColor": "#fff"
        },
        "title": {
            "text": "Meals Data Analysis"
        },
        "xAxis": {
            "categories": [
                "1",
                "2",
                "3",
                "4",
                "5",
                "6",
                "7",
                "Average:"
            ],
            "title": {
                "text": "Day of Week",
                "style": {
                    "color": "#000",
                    "fontSize": "14px"
                }
            },
            "labels": {
                "style": {
                    "color": "#000",
                    "fontSize": "12px"
                }
            }
        },
        "yAxis": {
            "title": {
                "text": "Number of Meals",
                "style": {
                    "color": "#000",
                    "fontSize": "14px"
                }
            },
            "labels": {
                "style": {
                    "color": "#000",
                    "fontSize": "12px"
                }
            }
        },
        "series": [
            {
                "name": "Sold meals",
                "data": [
                    10,
                    20,
                    30,
                    40,
                    50,
                    60,
                    null,
                    35
                ],
                "color": "green"
            },
            {
                "name": "Disposed meals",
                "data": [
                    1,
                    2,
                    4,
                    8,
                    16,
                    32,
                    null,
                    10.5
                ],
                "color": "red"
            },
            {
                "name": "Total meals",
                "data": [
                    11,
                    22,
                    34,
                    48,
                    66,
                    92,
                    null,
                    45.5
                ],
                "color": "blue"
            }
        ],
        "legend": {
            "layout": "horizontal",
            "align": "center",
            "verticalAlign": "bottom"
        }
    },
    "visualization_explanation": "The provided Highcharts chartOptions object is configured to render a spline chart with specific details. The chart type is set to 'spline', and it has a white background. The title of the chart is 'Meals Data Analysis'. The x-axis represents the 'Day of Week' with labels styled in black and a font size of 12px. The y-axis represents the 'Number of Meals' with similar styling. The chart includes three data series: 'Sold meals', 'Disposed meals', and 'Total meals', each with custom colors (green, red, and blue, respectively). The legend is positioned at the bottom of the chart, centered horizontally."
}