{
    "visualization_prompt": "Create a Highcharts chartOptions object to render a column chart with the title 'Monthly Sales Data'. The chart should have axes and labels styled with a dark blue color and a font size of 12px. The data series should include four series with the names 'Product A', 'Product B', 'Product C', and 'Product D', each with corresponding sales data for the months January to April. The chart should use custom colors for each series: red, green, blue, and yellow. Additionally, the chart should have a white background, a legend positioned at the bottom, and a margin of 20px around the chart.",
    "visualization_code": {
        "chart": {
            "type": "column",
            "backgroundColor": "#ffffff",
            "margin": 20
        },
        "title": {
            "text": "Monthly Sales Data",
            "style": {
                "color": "#00008B",
                "fontSize": "16px"
            }
        },
        "xAxis": {
            "categories": [
                "Jan",
                "Feb",
                "Mar",
                "Apr"
            ],
            "labels": {
                "style": {
                    "color": "#00008B",
                    "fontSize": "12px"
                }
            }
        },
        "yAxis": {
            "title": {
                "text": "Sales",
                "style": {
                    "color": "#00008B",
                    "fontSize": "12px"
                }
            },
            "labels": {
                "style": {
                    "color": "#00008B",
                    "fontSize": "12px"
                }
            }
        },
        "legend": {
            "layout": "horizontal",
            "align": "center",
            "verticalAlign": "bottom",
            "itemStyle": {
                "color": "#00008B",
                "fontSize": "12px"
            }
        },
        "series": [
            {
                "name": "Product A",
                "data": [
                    10,
                    15,
                    13,
                    17
                ],
                "color": "#FF0000"
            },
            {
                "name": "Product B",
                "data": [
                    12,
                    9,
                    15,
                    10
                ],
                "color": "#008000"
            },
            {
                "name": "Product C",
                "data": [
                    5,
                    7,
                    14,
                    12
                ],
                "color": "#0000FF"
            },
            {
                "name": "Product D",
                "data": [
                    8,
                    6,
                    11,
                    9
                ],
                "color": "#FFFF00"
            }
        ]
    },
    "visualization_explanation": "The provided Highcharts chartOptions object is configured to render a column chart titled 'Monthly Sales Data'. The chart includes four data series representing different products with sales data for the months January to April. Each series is assigned a custom color: red for 'Product A', green for 'Product B', blue for 'Product C', and yellow for 'Product D'. The axes and labels are styled with a dark blue color and a font size of 12px. The chart has a white background and a margin of 20px around its edges. The legend is positioned at the bottom of the chart, centered horizontally, and styled with the same dark blue color and font size."
}