{
    "visualization_prompt": "Create a Highcharts chartOptions object that renders a column chart. The chart should have a title 'Monthly Sales Data'. The x-axis should display categories 'Jan', 'Feb', 'Mar', 'Apr' with labels styled in blue color and font size of 14px. The y-axis should not have a title but should have labels styled in green color and font size of 12px. The data series should include one series named 'Sales' with data [29.9, 71.5, 106.4, 129.2]. The chart should have a light gray background and a legend positioned at the bottom of the chart. The chart should also have custom colors for the columns: ['#FF5733', '#33FF57', '#3357FF', '#FF33A1'].",
    "visualization_code": {
        "chart": {
            "type": "column",
            "backgroundColor": "#F5F5F5"
        },
        "title": {
            "text": "Monthly Sales Data"
        },
        "xAxis": {
            "categories": [
                "Jan",
                "Feb",
                "Mar",
                "Apr"
            ],
            "labels": {
                "style": {
                    "color": "blue",
                    "fontSize": "14px"
                }
            }
        },
        "yAxis": {
            "title": {
                "text": false
            },
            "labels": {
                "style": {
                    "color": "green",
                    "fontSize": "12px"
                }
            }
        },
        "series": [
            {
                "name": "Sales",
                "data": [
                    29.9,
                    71.5,
                    106.4,
                    129.2
                ],
                "colorByPoint": true,
                "colors": [
                    "#FF5733",
                    "#33FF57",
                    "#3357FF",
                    "#FF33A1"
                ]
            }
        ],
        "legend": {
            "layout": "horizontal",
            "align": "center",
            "verticalAlign": "bottom"
        }
    },
    "visualization_explanation": "The provided Highcharts chartOptions object configures a column chart with specific styling and data. The chart type is set to 'column', and it has a title 'Monthly Sales Data'. The x-axis displays categories 'Jan', 'Feb', 'Mar', 'Apr' with blue labels of font size 14px. The y-axis labels are green with a font size of 12px and do not have a title. The data series includes one series named 'Sales' with the data [29.9, 71.5, 106.4, 129.2]. The columns are colored using a custom color palette ['#FF5733', '#33FF57', '#3357FF', '#FF33A1']. The chart has a light gray background, and the legend is positioned at the bottom of the chart, centered horizontally."
}